{"v":1,"root_id":"internal-rpc-authority-readback-manifest-root-v1","root_generation":1,"purpose":"NORMAL_READBACK_ROOT_VERIFICATION","aud":"urn:mattercodex:internal-rpc-authority-readback-attestor:root-verification","kid":"ira-readback-root-g1","public_jwk":{"kty":"EC","crv":"P-256","use":"sig","key_ops":["verify"],"alg":"ES256","kid":"ira-readback-root-g1","x":"fzqDZ7JKv1DqigBh9RhX7qhSfCKaTpJ742v4GqP6nQM","y":"l3QpBPKJwlLFoRkPWXtFbtkqaTHturx8vc_CxZjCJ4s"},"jwk_thumbprint_sha256":"417729147c33f5ee1adfe37ed205239469044b73d82ff59e784cfe37639c70a6","source_revision":1,"source_digest_sha256":"a044a23b0409e0c54262a62c917c5a143ca09a98a8fc063f0828bf4daa1e800c","not_before":1785369600,"not_after":2100902400}
